{
  "$schema": "https://json-schema.org/draft/2020-12/schema",
  "$id": "https://example.com/swe-bench-mini/task_schema.json",
  "title": "SWE-Bench Mini Task Schema",
  "description": "Canonical schema for one benchmark task in the SWE-Bench Mini repository.",
  "type": "object",
  "additionalProperties": false,
  "required": [
    "task_id",
    "title",
    "difficulty",
    "tags",
    "setup_command",
    "baseline_fail_command",
    "candidate_test_command",
    "full_test_command",
    "timeout_seconds",
    "forbidden_paths"
  ],
  "properties": {
    "task_id": {
      "type": "string",
      "pattern": "^task_[0-9]{2}_[a-z0-9_]+$",
      "description": "Stable identifier for the task directory and reporting."
    },
    "title": {
      "type": "string",
      "minLength": 1,
      "description": "Short human-readable title."
    },
    "difficulty": {
      "type": "string",
      "enum": [
        "easy",
        "medium",
        "hard"
      ],
      "description": "Relative debugging difficulty."
    },
    "tags": {
      "type": "array",
      "minItems": 1,
      "items": {
        "type": "string",
        "minLength": 1
      },
      "description": "Category labels used for filtering and reporting."
    },
    "entry_point": {
      "type": "string",
      "minLength": 1,
      "description": "Primary file or module where the bug is expected to be fixed."
    },
    "editable_paths": {
      "type": "array",
      "minItems": 1,
      "items": {
        "type": "string",
        "minLength": 1
      },
      "description": "Explicit allowlist of paths a candidate patch may modify."
    },
    "setup_command": {
      "type": "string",
      "description": "Optional per-task setup command. Use an empty string when no setup is required."
    },
    "baseline_fail_command": {
      "type": "string",
      "minLength": 1,
      "description": "Regression test command that must fail on the buggy snapshot."
    },
    "candidate_test_command": {
      "type": "string",
      "minLength": 1,
      "description": "Targeted regression command that must pass after applying a candidate patch."
    },
    "full_test_command": {
      "type": "string",
      "minLength": 1,
      "description": "Whole-task test suite command that must pass after applying a candidate patch."
    },
    "timeout_seconds": {
      "type": "integer",
      "minimum": 1,
      "description": "Maximum time allowed for setup, patch application, and tests."
    },
    "forbidden_paths": {
      "type": "array",
      "minItems": 1,
      "items": {
        "type": "string",
        "minLength": 1
      },
      "description": "Immutable files and directories that must never be edited during evaluation."
    }
  },
  "oneOf": [
    {
      "required": [
        "entry_point"
      ]
    },
    {
      "required": [
        "editable_paths"
      ]
    }
  ],
  "examples": [
    {
      "task_id": "task_01_off_by_one",
      "title": "Fix inclusive range handling",
      "difficulty": "easy",
      "tags": [
        "python",
        "parsing",
        "off-by-one"
      ],
      "editable_paths": [
        "context/app/range_utils.py"
      ],
      "setup_command": "",
      "baseline_fail_command": "pytest tests/test_range_utils.py -q",
      "candidate_test_command": "pytest tests/test_range_utils.py -q",
      "full_test_command": "pytest -q",
      "timeout_seconds": 30,
      "forbidden_paths": [
        "tests/**",
        "gold/**",
        "metadata.json",
        "task.json"
      ]
    }
  ]
}
